{
  "schemaVersion": "0.1.0",
  "workspace": "pipe-venture-builder",
  "team": "Natiivis",
  "project": {
    "id": "c461563e-99ce-488e-b368-428eeb34c384",
    "name": "Protocolo de trabalho no Linear",
    "url": "https://linear.app/pipe-venture-builder/project/protocolo-de-trabalho-no-linear-7fbe34fff9f3"
  },
  "initiative": null,
  "notes": "Iniciativa nula por ora: o workspace ainda não tem uma iniciativa por venture. Decisão em aberto com o fundador."
}
